utterance,visId,gt,dataset,gtId,id
A bar chart with sum of buying on x and currency on y.,exp-580,"{'height': {'step': 17}, 'mark': {'type': 'bar'}, 'encoding': {'y': {'field': 'currency', 'type': 'nominal', 'sort': '-x'}, 'x': {'aggregate': 'sum', 'field': 'buying'}}, 'data': {'url': 'currency.json'}}",currency,exp-580,exp-580
Shows the relationship between minutes_played_per_game and teams using tick marks.,exp-581,"{'mark': {'type': 'tick'}, 'encoding': {'x': {'field': 'minutes_played_per_game', 'type': 'quantitative'}, 'y': {'field': 'team', 'type': 'nominal'}}, 'data': {'url': 'nba_cleaned.json'}}",nba_cleaned,exp-581,exp-581
"Create a graph to show the correlation between video views and ranks, using squares to represent each point.",exp-582,"{'mark': {'type': 'square'}, 'encoding': {'x': {'field': 'video_views', 'type': 'quantitative'}, 'y': {'field': 'rank', 'type': 'quantitative'}}, 'data': {'url': 'top-300-youtube-channels.json'}}",top-300-youtube-channels,exp-582,exp-582
Draw a diagram that illustrates the relationship between min_life_expectancy and family_friendly using square marks.,exp-583,"{'mark': {'type': 'square'}, 'encoding': {'x': {'field': 'min_life_expectancy', 'type': 'quantitative'}, 'y': {'field': 'family_friendly', 'type': 'quantitative'}}, 'data': {'url': 'cat_breeds.json'}}",cat_breeds,exp-583,exp-583
Create a visualization that plots internet business on the x-axis and its counts on the y-axis.,exp-584,"{'mark': {'type': 'bar'}, 'encoding': {'x': {'bin': True, 'field': 'internet business'}, 'y': {'aggregate': 'count', 'type': 'nominal'}}, 'data': {'url': 'google-trends-microbusiness-smallbusiness-internetbusiness-sidejob.json'}}",google-trends-microbusiness-smallbusiness-internetbusiness-sidejob,exp-584,exp-584
Visualize the sum of gdp with a bar chart.,exp-585,"{'mark': {'type': 'bar'}, 'encoding': {'x': {'aggregate': 'sum', 'field': 'gdp ( billions in usd)'}}, 'data': {'url': 'Bangladesh GDP History 1972-2022.json'}}",bangladesh gdp history 1972-2022,exp-585,exp-585
Construct a bar chart to illustrate the sum of total sulfur dioxides for various qualities?,exp-586,"{'height': {'step': 17}, 'mark': {'type': 'bar'}, 'encoding': {'y': {'field': 'quality'}, 'x': {'aggregate': 'sum', 'field': 'total_sulfur_dioxide'}}, 'data': {'url': 'Wine_Quality_Data.json'}}",wine_quality_data,exp-586,exp-586
Create a scatterplot with penalty_faced on the x-axis and fwd_pass on the y-axis and use filled points.,exp-587,"{'mark': {'type': 'point', 'filled': True}, 'encoding': {'x': {'field': 'penalty_faced', 'type': 'quantitative'}, 'y': {'field': 'fwd_pass', 'type': 'quantitative'}}, 'data': {'url': 'MLS_pl_2021_stats_w_2022_salaries.json'}}",mls_pl_2021_stats_w_2022_salaries,exp-587,exp-587
"Can you illustrate the median, minimum, and maximum of ages for different teams using a vertical box plot?",exp-588,"{'mark': {'type': 'boxplot', 'extent': 'min-max'}, 'encoding': {'x': {'field': 'team', 'type': 'nominal'}, 'color': {'field': 'team', 'type': 'nominal', 'legend': None}, 'y': {'field': 'age', 'type': 'quantitative', 'scale': {'zero': False}}}, 'data': {'url': 'nba_cleaned.json'}}",nba_cleaned,exp-588,exp-588
Draw a histogram of foot types.,exp-589,"{'mark': {'type': 'bar'}, 'encoding': {'x': {'field': 'foot'}, 'y': {'aggregate': 'count'}}, 'data': {'url': 'MLS_pl_2021_stats_w_2022_salaries.json'}}",mls_pl_2021_stats_w_2022_salaries,exp-589,exp-589
"Plot the votes against the dates, with each type of places having its own color.",exp-590,"{'mark': {'type': 'line'}, 'encoding': {'x': {'field': 'date', 'type': 'temporal'}, 'y': {'field': 'votes', 'type': 'quantitative'}, 'color': {'field': 'place', 'type': 'nominal'}}, 'data': {'url': 'election.json'}}",election,exp-590,exp-590
Plot a line chart of maximum recovery cases explosive of each year. ,exp-591,"{'mark': {'type': 'line'}, 'encoding': {'x': {'timeUnit': 'yearmonth', 'field': 'year'}, 'y': {'aggregate': 'max', 'field': 'recovery_cases_explosive'}}, 'data': {'url': 'crime_data_bangladesh.json'}}",crime_data_bangladesh,exp-591,exp-591
Show the values of student id using a vertical box plot.,exp-592,"{'mark': {'type': 'boxplot'}, 'encoding': {'y': {'field': 'student_id', 'type': 'quantitative', 'scale': {'zero': False}}}, 'data': {'url': 'Students_gamification_grades.json'}}",students_gamification_grades,exp-592,exp-592
Visualize the buying range and mean values for each currency using horizontal error bar charts with black points showing the mean value.,exp-593,"{'layer': [{'mark': 'errorbar', 'encoding': {'x': {'field': 'buying', 'type': 'quantitative', 'scale': {'zero': False}}, 'y': {'field': 'currency', 'type': 'ordinal'}}}, {'mark': {'type': 'point', 'filled': True, 'color': 'black'}, 'encoding': {'x': {'field': 'buying', 'type': 'quantitative', 'aggregate': 'mean'}, 'y': {'field': 'currency', 'type': 'ordinal'}}}], 'data': {'url': 'currency.json'}}",currency,exp-593,exp-593
Draw a visualization to compare the riot over time across each area.,exp-594,"{'mark': {'type': 'line'}, 'encoding': {'x': {'field': 'year', 'type': 'temporal'}, 'y': {'field': 'riot ', 'type': 'quantitative'}, 'color': {'field': 'area_name', 'type': 'nominal'}}, 'data': {'url': 'crime_data_bangladesh.json'}}",crime_data_bangladesh,exp-594,exp-594
Draw a visualization of the area chart with different obs flags to display the density of obs values?,exp-595,"{'width': 400, 'height': 80, 'mark': {'type': 'area'}, 'transform': [{'density': 'obs_value', 'groupby': ['obs_flag']}], 'encoding': {'x': {'field': 'value', 'type': 'quantitative'}, 'y': {'field': 'density', 'type': 'quantitative', 'stack': 'zero'}, 'row': {'field': 'obs_flag'}}, 'data': {'url': 'prc_hpi_a__custom_5188771_page_linear.json'}}",prc_hpi_a__custom_5188771_page_linear,exp-595,exp-595
Can you please present a scatterplot of sos_adj_d_rank and adj_o using orange rectangles as marks?,exp-596,"{'mark': {'type': 'point'}, 'encoding': {'x': {'field': 'sos_adj_d_rank', 'type': 'quantitative'}, 'y': {'field': 'adj_o', 'type': 'quantitative'}, 'color': {'value': '#ff9900'}, 'shape': {'value': 'square'}}, 'data': {'url': 'Kenpom-leaky.json'}}",kenpom-leaky,exp-596,exp-596
Draw a histogram of buying with at most 5 bins!,exp-597,"{'mark': {'type': 'bar'}, 'encoding': {'x': {'bin': {'maxbins': 5}, 'field': 'buying'}, 'y': {'aggregate': 'count'}}, 'data': {'url': 'currency.json'}}",currency,exp-597,exp-597
Draw a strip plot chart showing the mean of weight of each club.,exp-598,"{'mark': {'type': 'rule'}, 'encoding': {'y': {'field': 'weight', 'type': 'quantitative', 'aggregate': 'mean'}, 'size': {'value': 2}, 'color': {'field': 'club', 'type': 'nominal'}}, 'data': {'url': 'EPL_Soccer_MLR_LR.json'}}",epl_soccer_mlr_lr,exp-598,exp-598
Draw an area chart that illustrates the cumulative frequency of sells.,exp-599,"{'transform': [{'sort': [{'field': 'sell'}], 'window': [{'op': 'count', 'field': 'count', 'as': 'Cumulative Count'}], 'frame': [None, 0]}], 'mark': {'type': 'area'}, 'encoding': {'x': {'field': 'sell', 'type': 'quantitative'}, 'y': {'field': 'Cumulative Count', 'type': 'quantitative'}}, 'data': {'url': 'currency.json'}}",currency,exp-599,exp-599
"Create a visualization representing specimens_7d_avg on the x-axis, percentage_7d_avg on the y-axis, and variant names with different colors.",exp-600,"{'mark': {'type': 'point'}, 'encoding': {'x': {'field': 'percentage_7d_avg', 'type': 'quantitative'}, 'y': {'field': 'specimens_7d_avg', 'type': 'quantitative'}, 'color': {'field': 'variant_name', 'type': 'nominal'}}, 'data': {'url': 'covid19_variant.json'}}",covid19_variant,exp-600,exp-600
What is the mean buying over date? Show a line chart at monthly interval.,exp-601,"{'mark': {'type': 'line'}, 'encoding': {'x': {'timeUnit': 'month', 'field': 'date'}, 'y': {'aggregate': 'mean', 'field': 'buying'}}, 'data': {'url': 'currency.json'}}",currency,exp-601,exp-601
Create a line chart illustrating the changes in blocks_per_game over time.,exp-602,"{'mark': {'type': 'line'}, 'encoding': {'x': {'field': 'season', 'type': 'temporal'}, 'y': {'field': 'blocks_per_game', 'type': 'quantitative', 'aggregate': 'sum'}}, 'data': {'url': 'nba_cleaned.json'}}",nba_cleaned,exp-602,exp-602
Draw a stacked bar chart with rounded corner showing the count broken by different damage dealt and extra positions. Colored by extra positions.,exp-603,"{'mark': {'type': 'bar'}, 'encoding': {'x': {'field': 'damage dealt', 'type': 'nominal'}, 'y': {'aggregate': 'count'}, 'color': {'field': 'position'}}, 'config': {'bar': {'cornerRadiusTopLeft': 8, 'cornerRadiusTopRight': 8}}, 'data': {'url': 'ROV.json'}}",rov,exp-603,exp-603
Create a line chart to visualize the changes in dacolty over time and distinguish the areas using different colors.,exp-604,"{'mark': {'type': 'line'}, 'encoding': {'x': {'field': 'year', 'type': 'temporal'}, 'y': {'field': 'dacoity', 'type': 'quantitative'}, 'color': {'field': 'area_name', 'type': 'nominal'}}, 'data': {'url': 'crime_data_bangladesh.json'}}",crime_data_bangladesh,exp-604,exp-604
"A point graph with dacoity on x axis, woman_child_repression on y axis, and binned recovery_cases_narcotics on point opacity.",exp-605,"{'mark': {'type': 'point'}, 'encoding': {'x': {'field': 'dacoity', 'type': 'quantitative'}, 'y': {'field': 'woman_child_repression', 'type': 'quantitative'}, 'opacity': {'bin': True, 'field': 'recovery_cases_narcotics'}}, 'data': {'url': 'crime_data_bangladesh.json'}}",crime_data_bangladesh,exp-605,exp-605
"Draw a vertical stacked bar chart that shows the sum of price for different teams and national sides, with color denoting the national sides.",exp-606,"{'mark': {'type': 'bar'}, 'encoding': {'x': {'field': 'team'}, 'y': {'aggregate': 'sum', 'field': 'price (us$)'}, 'color': {'field': 'national side'}}, 'data': {'url': 'auction_2023.json'}}",auction_2023,exp-606,exp-606
Visualizing the cumulative frequency of gdps using an area graph.,exp-607,"{'transform': [{'sort': [{'field': 'gdp ( billions in usd)'}], 'window': [{'op': 'count', 'field': 'count', 'as': 'Cumulative Count'}], 'frame': [None, 0]}], 'mark': {'type': 'area'}, 'encoding': {'x': {'field': 'gdp ( billions in usd)', 'type': 'quantitative'}, 'y': {'field': 'Cumulative Count', 'type': 'quantitative'}}, 'data': {'url': 'Bangladesh GDP History 1972-2022.json'}}",bangladesh gdp history 1972-2022,exp-607,exp-607
"Create a scatterplot with sos_adj_em_rank on the x-axis, ncaa_seed on the y-axis, and represent conference with different colors.",exp-608,"{'mark': {'type': 'point'}, 'encoding': {'x': {'field': 'sos_adj_em_rank', 'type': 'quantitative'}, 'y': {'field': 'ncaa_seed', 'type': 'quantitative'}, 'color': {'field': 'conference', 'type': 'nominal'}}, 'data': {'url': 'Kenpom-leaky.json'}}",kenpom-leaky,exp-608,exp-608
"Please generate a chart that displays the correlation between first_place_vote and games, with the opacity of each point representing points_per_game.",exp-609,"{'mark': {'type': 'point'}, 'encoding': {'x': {'field': 'first_place_vote', 'type': 'quantitative'}, 'y': {'field': 'games', 'type': 'quantitative'}, 'opacity': {'bin': True, 'field': 'points_per_game'}}, 'data': {'url': 'nba_cleaned.json'}}",nba_cleaned,exp-609,exp-609
"Create an stacked area chart showing the total dacoity over the years, divided by area names.",exp-610,"{'width': 300, 'height': 200, 'mark': {'type': 'area'}, 'encoding': {'x': {'timeUnit': 'yearmonth', 'field': 'year', 'axis': {'format': '%Y'}}, 'y': {'aggregate': 'sum', 'field': 'dacoity'}, 'color': {'field': 'area_name', 'scale': {'scheme': 'category20b'}}}, 'data': {'url': 'crime_data_bangladesh.json'}}",crime_data_bangladesh,exp-610,exp-610
"Create a visualization that shows the joint distribution of room counts and bathroom counts, with the size of points representing the count?",exp-611,"{'mark': {'type': 'point'}, 'encoding': {'x': {'bin': {'maxbins': 10}, 'field': 'room_count'}, 'y': {'bin': {'maxbins': 10}, 'field': 'bathroom_count'}, 'size': {'aggregate': 'count'}}, 'data': {'url': 'apartments.json'}}",apartments,exp-611,exp-611
Generate a heatmap that demonstrates the count distribution between heights and scores.,exp-612,"{'mark': {'type': 'rect'}, 'width': 300, 'height': 200, 'encoding': {'x': {'bin': {'maxbins': 60}, 'field': 'height', 'type': 'quantitative'}, 'y': {'bin': {'maxbins': 40}, 'field': 'score', 'type': 'quantitative'}, 'color': {'aggregate': 'count', 'type': 'quantitative'}}, 'config': {'view': {'stroke': 'transparent'}}, 'data': {'url': 'EPL_Soccer_MLR_LR.json'}}",epl_soccer_mlr_lr,exp-612,exp-612
Create a bar chart that illustrates the total of gold.,exp-613,"{'mark': {'type': 'bar'}, 'encoding': {'x': {'aggregate': 'sum', 'field': 'gold'}}, 'data': {'url': 'ROV.json'}}",rov,exp-613,exp-613
"Create a visualization that shows the joint distribution of high and volumes, with the size of points representing the count?",exp-614,"{'mark': {'type': 'point'}, 'encoding': {'x': {'bin': {'maxbins': 10}, 'field': 'volume'}, 'y': {'bin': {'maxbins': 10}, 'field': 'high'}, 'size': {'aggregate': 'count'}}, 'data': {'url': 'Brazilian Corn Futures.json'}}",brazilian corn futures,exp-614,exp-614
Create a visualization to compare adj_d and luck for each conference. ,exp-615,"{'width': 75, 'height': 75, 'mark': {'type': 'point'}, 'encoding': {'column': {'field': 'conference'}, 'x': {'field': 'luck', 'type': 'quantitative'}, 'y': {'field': 'adj_d', 'type': 'quantitative'}}, 'data': {'url': 'Kenpom-leaky.json'}}",kenpom-leaky,exp-615,exp-615
Produce a histogram of adj em metrics with a bin space of 2?,exp-616,"{'mark': {'type': 'bar', 'binSpacing': 2}, 'encoding': {'x': {'bin': True, 'field': 'adj_em'}, 'y': {'aggregate': 'count'}}, 'data': {'url': 'Kenpom-leaky.json'}}",kenpom-leaky,exp-616,exp-616
Draw a histogram of buying prices. Set the bin space to 4 and set the x-axis to be reverse order.,exp-617,"{'mark': {'type': 'bar', 'binSpacing': 4}, 'encoding': {'x': {'bin': True, 'field': 'buying', 'scale': {'reverse': True}}, 'y': {'aggregate': 'count'}}, 'data': {'url': 'currency.json'}}",currency,exp-617,exp-617
Draw a line chart with points to display the average buying for each year broken by different currencies!,exp-618,"{'mark': {'type': 'line', 'point': True}, 'encoding': {'x': {'timeUnit': 'year', 'field': 'date'}, 'y': {'aggregate': 'mean', 'field': 'buying', 'type': 'quantitative'}, 'color': {'field': 'currency', 'type': 'nominal'}}, 'data': {'url': 'currency.json'}}",currency,exp-618,exp-618
Generate a vertical histogram that displays the specimens data and the mean of specimens.,exp-619,"{'layer': [{'mark': 'bar', 'encoding': {'x': {'field': 'specimens', 'bin': True}, 'y': {'aggregate': 'count'}}}, {'mark': 'rule', 'encoding': {'x': {'aggregate': 'mean', 'field': 'specimens'}, 'color': {'value': 'red'}, 'size': {'value': 5}}}], 'data': {'url': 'covid19_variant.json'}}",covid19_variant,exp-619,exp-619
"Could you please draw a stacked area chart that shows the sum of games played versus year, split by teams, with center stacking?",exp-620,"{'width': 300, 'height': 200, 'mark': {'type': 'area'}, 'encoding': {'x': {'timeUnit': 'yearmonth', 'field': 'season', 'axis': {'domain': False, 'format': '%Y', 'tickSize': 0}}, 'y': {'aggregate': 'sum', 'field': 'games', 'stack': 'center'}, 'color': {'field': 'team'}}, 'data': {'url': 'nba_cleaned.json'}}",nba_cleaned,exp-620,exp-620
"Please create a scatterplot featuring total wins on the x-axis, total losses on the y-axis, foot types as a color, and assists as size with a custom star mark.",exp-621,"{'mark': {'type': 'point'}, 'encoding': {'x': {'field': 'total_wins', 'type': 'quantitative'}, 'y': {'field': 'total_losses', 'type': 'quantitative'}, 'color': {'field': 'foot', 'type': 'nominal'}, 'size': {'field': 'assist', 'type': 'quantitative'}, 'shape': {'value': 'M0,0.2L0.2351,0.3236 0.1902,0.0618 0.3804,-0.1236 0.1175,-0.1618 0,-0.4 -0.1175,-0.1618 -0.3804,-0.1236 -0.1902,0.0618 -0.2351,0.3236 0,0.2Z'}}, 'data': {'url': 'MLS_pl_2021_stats_w_2022_salaries.json'}}",mls_pl_2021_stats_w_2022_salaries,exp-621,exp-621
Could you make a strip plot that shows the costs from highest to lowest? ,exp-622,"{'mark': {'type': 'tick'}, 'encoding': {'x': {'field': 'cost', 'type': 'quantitative', 'sort': 'descending'}}, 'data': {'url': 'EPL_Soccer_MLR_LR.json'}}",epl_soccer_mlr_lr,exp-622,exp-622
Create a bar graph illustrating the mean of vr deck organized by sides.,exp-623,"{'mark': {'type': 'bar'}, 'encoding': {'x': {'field': 'side'}, 'y': {'aggregate': 'mean', 'field': 'vrdeck'}}, 'data': {'url': 'Cleaned and imputed data 2.json'}}",cleaned and imputed data 2,exp-623,exp-623
"Plot a bar graph to illustrate the count of registration ids, ordered from highest to lowest.",exp-624,"{'mark': {'type': 'bar'}, 'encoding': {'x': {'field': 'registration_id', 'sort': {'op': 'count', 'order': 'descending'}}, 'y': {'aggregate': 'count'}}, 'data': {'url': 'student_tests_taken.json'}}",student_tests_taken,exp-624,exp-624
Generate an area chart to compare police_assault versus year.,exp-625,"{'width': 300, 'height': 200, 'mark': {'type': 'area'}, 'encoding': {'x': {'timeUnit': 'yearmonth', 'field': 'year', 'axis': {'format': '%Y'}}, 'y': {'aggregate': 'sum', 'field': 'police_assault', 'title': 'police_assault'}}, 'data': {'url': 'crime_data_bangladesh.json'}}",crime_data_bangladesh,exp-625,exp-625
Create a bar chart that displays the sum of sos_adj_em_rank on the x-axis.,exp-626,"{'mark': {'type': 'bar'}, 'encoding': {'x': {'aggregate': 'sum', 'field': 'sos_adj_em_rank'}}, 'data': {'url': 'Kenpom-leaky.json'}}",kenpom-leaky,exp-626,exp-626
"Create a horizontal box plot to show the median, lower and upper quartiles of the distribution of y coord cd.",exp-627,"{'mark': {'type': 'boxplot', 'extent': 1.5, 'median': {'color': 'red'}, 'ticks': True}, 'encoding': {'x': {'field': 'y_coord_cd', 'type': 'quantitative', 'scale': {'zero': False}}}, 'data': {'url': 'NYPD_Shooting_Incident_Data__Year_To_Date_.json'}}",nypd_shooting_incident_data__year_to_date_,exp-627,exp-627
"Visualize the data of author_num_games_owned on the x-axis, author_playtime_at_review on the y-axis, recieved_for_free as a color, and steam_purchase as size with a custom star mark.",exp-628,"{'mark': {'type': 'point'}, 'encoding': {'x': {'field': 'author_num_games_owned', 'type': 'quantitative'}, 'y': {'field': 'author_playtime_at_review', 'type': 'quantitative'}, 'color': {'field': 'recieved_for_free', 'type': 'nominal'}, 'size': {'field': 'steam_purchase', 'type': 'quantitative'}, 'shape': {'value': 'M0,0.2L0.2351,0.3236 0.1902,0.0618 0.3804,-0.1236 0.1175,-0.1618 0,-0.4 -0.1175,-0.1618 -0.3804,-0.1236 -0.1902,0.0618 -0.2351,0.3236 0,0.2Z'}}, 'data': {'url': 'elden_ring_steam_reviews.json'}}",elden_ring_steam_reviews,exp-628,exp-628
Visualize adj_o_rank values in a point graph. ,exp-629,"{'mark': {'type': 'point'}, 'encoding': {'x': {'field': 'adj_o_rank', 'type': 'quantitative'}}, 'data': {'url': 'Kenpom-leaky.json'}}",kenpom-leaky,exp-629,exp-629
Create a bar chart to represent the mean of resident ids for different months of move out dates? ,exp-630,"{'mark': {'type': 'bar'}, 'encoding': {'x': {'timeUnit': 'month', 'field': 'date_moved_out'}, 'y': {'aggregate': 'mean', 'field': 'resident_id'}}, 'data': {'url': 'residents.json'}}",residents,exp-630,exp-630
"Generate a horizontal box plot to show latitude for loc_of_occur_desc, with a tooltip of mean values when hovering!",exp-631,"{'mark': {'type': 'boxplot'}, 'encoding': {'y': {'field': 'loc_of_occur_desc', 'type': 'nominal'}, 'x': {'field': 'latitude', 'type': 'quantitative', 'scale': {'zero': False}}, 'tooltip': {'field': 'latitude', 'aggregate': 'mean'}}, 'data': {'url': 'NYPD_Shooting_Incident_Data__Year_To_Date_.json'}}",nypd_shooting_incident_data__year_to_date_,exp-631,exp-631
Build a histogram of field_goal_perc with a bin space of 2.,exp-632,"{'mark': {'type': 'bar', 'binSpacing': 2}, 'encoding': {'x': {'bin': True, 'field': 'field_goal_perc'}, 'y': {'aggregate': 'count'}}, 'data': {'url': 'nba_cleaned.json'}}",nba_cleaned,exp-632,exp-632
Visualize price using a strip plot in descending order.,exp-633,"{'mark': {'type': 'tick'}, 'encoding': {'x': {'field': 'price', 'type': 'quantitative', 'sort': 'descending'}}, 'data': {'url': 'laptopData.json'}}",laptopdata,exp-633,exp-633
Create a boxplot to visualize gdp?,exp-634,"{'mark': {'type': 'boxplot'}, 'encoding': {'x': {'field': 'gdp ( billions in usd)', 'type': 'quantitative', 'scale': {'zero': False}}}, 'data': {'url': 'Bangladesh GDP History 1972-2022.json'}}",bangladesh gdp history 1972-2022,exp-634,exp-634
"Draw a scatterplot with goals on the x-axis, assist on the y-axis, foot types as a color, and mins as size and use a custom star mark.",exp-635,"{'mark': {'type': 'point'}, 'encoding': {'x': {'field': 'goals', 'type': 'quantitative'}, 'y': {'field': 'assist', 'type': 'quantitative'}, 'color': {'field': 'foot', 'type': 'nominal'}, 'size': {'field': 'mins', 'type': 'quantitative'}, 'shape': {'value': 'M0,0.2L0.2351,0.3236 0.1902,0.0618 0.3804,-0.1236 0.1175,-0.1618 0,-0.4 -0.1175,-0.1618 -0.3804,-0.1236 -0.1902,0.0618 -0.2351,0.3236 0,0.2Z'}}, 'data': {'url': 'MLS_pl_2021_stats_w_2022_salaries.json'}}",mls_pl_2021_stats_w_2022_salaries,exp-635,exp-635
"For each origin, draw an error bar of fino values with a black dot showing the mean fino value.",exp-636,"{'layer': [{'mark': 'errorbar', 'encoding': {'x': {'field': 'flno', 'type': 'quantitative', 'scale': {'zero': False}}, 'y': {'field': 'origin', 'type': 'ordinal'}}}, {'mark': {'type': 'point', 'filled': True, 'color': 'black'}, 'encoding': {'x': {'field': 'flno', 'type': 'quantitative', 'aggregate': 'mean'}, 'y': {'field': 'origin', 'type': 'ordinal'}}}], 'data': {'url': 'flight.json'}}",flight,exp-636,exp-636
"Create a stacked area chart to depict the sum of sells versus year, divided by currency.",exp-637,"{'width': 300, 'height': 200, 'mark': {'type': 'area'}, 'encoding': {'x': {'timeUnit': 'yearmonth', 'field': 'date', 'axis': {'format': '%Y'}}, 'y': {'aggregate': 'sum', 'field': 'sell'}, 'color': {'field': 'currency', 'scale': {'scheme': 'category20b'}}}, 'data': {'url': 'currency.json'}}",currency,exp-637,exp-637
Create a visualization of jurisdiction codes with an error bar showing the mean value. ,exp-638,"{'layer': [{'mark': 'errorbar', 'encoding': {'x': {'field': 'jurisdiction_code', 'type': 'quantitative', 'scale': {'zero': False}}}}, {'mark': {'type': 'point', 'filled': True, 'color': 'black'}, 'encoding': {'x': {'field': 'jurisdiction_code', 'aggregate': 'mean', 'type': 'quantitative'}}}], 'data': {'url': 'NYPD_Shooting_Incident_Data__Year_To_Date_.json'}}",nypd_shooting_incident_data__year_to_date_,exp-638,exp-638
Create a heatmap to illustrate the distribution of blocks_per_game and age.,exp-639,"{'mark': {'type': 'rect'}, 'width': 300, 'height': 200, 'encoding': {'x': {'bin': {'maxbins': 60}, 'field': 'blocks_per_game', 'type': 'quantitative'}, 'y': {'bin': {'maxbins': 40}, 'field': 'age', 'type': 'quantitative'}, 'color': {'aggregate': 'count', 'type': 'quantitative'}}, 'config': {'view': {'stroke': 'transparent'}}, 'data': {'url': 'nba_cleaned.json'}}",nba_cleaned,exp-639,exp-639
Visualize the average sos_adj_d for each year in different conferences by drawing a line chart with points?,exp-640,"{'mark': {'type': 'line', 'point': True}, 'encoding': {'x': {'timeUnit': 'year', 'field': 'season'}, 'y': {'aggregate': 'mean', 'field': 'sos_adj_d', 'type': 'quantitative'}, 'color': {'field': 'conference', 'type': 'nominal'}}, 'data': {'url': 'Kenpom-leaky.json'}}",kenpom-leaky,exp-640,exp-640
A scatterplot with filled points comparing total_rebounds_per_game and rank.,exp-641,"{'mark': {'type': 'point', 'filled': True}, 'encoding': {'x': {'field': 'rank', 'type': 'quantitative'}, 'y': {'field': 'total_rebounds_per_game', 'type': 'quantitative'}}, 'data': {'url': 'nba_cleaned.json'}}",nba_cleaned,exp-641,exp-641
A strip plot of cost.,exp-642,"{'mark': {'type': 'tick'}, 'encoding': {'x': {'field': 'cost', 'type': 'quantitative'}}, 'data': {'url': 'EPL_Soccer_MLR_LR.json'}}",epl_soccer_mlr_lr,exp-642,exp-642
Draw a pie chart that displays the category' distribution.,exp-643,"{'mark': {'type': 'arc'}, 'encoding': {'theta': {'type': 'quantitative', 'aggregate': 'count'}, 'color': {'field': 'category', 'type': 'nominal'}}, 'data': {'url': 'SampleSuperstore.json'}}",samplesuperstore,exp-643,exp-643
Draw a visualization of the matches using a bot plot.,exp-644,"{'mark': {'type': 'boxplot'}, 'encoding': {'x': {'field': 'match', 'type': 'quantitative', 'scale': {'zero': False}}}, 'data': {'url': 'world_cup_2007.json'}}",world_cup_2007,exp-644,exp-644
"Create a bar chart with the sum of sulphates on the x-axis and types of colors on the y-axis, arranged in ascending order.",exp-645,"{'mark': {'type': 'bar'}, 'encoding': {'y': {'field': 'color', 'type': 'nominal', 'sort': {'op': 'sum', 'field': 'sulphates'}}, 'x': {'aggregate': 'sum', 'field': 'sulphates'}}, 'data': {'url': 'Wine_Quality_Data.json'}}",wine_quality_data,exp-645,exp-645
Create a histogram with adj_tempo_rank binned on x-axis and count on y-axis.,exp-646,"{'mark': {'type': 'bar'}, 'encoding': {'x': {'bin': True, 'field': 'adj_tempo_rank', 'type': 'ordinal'}, 'y': {'aggregate': 'count'}}, 'data': {'url': 'Kenpom-leaky.json'}}",kenpom-leaky,exp-646,exp-646
Draw bar charts to show the mean of codes for different months.,exp-647,"{'mark': {'type': 'bar'}, 'encoding': {'x': {'timeUnit': 'month', 'field': 'date'}, 'y': {'aggregate': 'mean', 'field': 'code'}}, 'data': {'url': 'data.json'}}",data,exp-647,exp-647
Create a bar chart that displays the sum of previous on the x-axis and the year on the y-axis.,exp-648,"{'height': {'step': 17}, 'mark': {'type': 'bar'}, 'encoding': {'y': {'field': 'year', 'type': 'nominal', 'sort': '-x'}, 'x': {'aggregate': 'sum', 'field': 'previous'}}, 'data': {'url': 'CPI.json'}}",cpi,exp-648,exp-648
